<?xml version="1.0" encoding="UTF-8"?>
<!--
  ~ Copyright 1999-2021 Percussion Software, Inc.
  ~
  ~ Licensed under the Apache License, Version 2.0 (the "License");
  ~ you may not use this file except in compliance with the License.
  ~ You may obtain a copy of the License at
  ~
  ~     http://www.apache.org/licenses/LICENSE-2.0
  ~
  ~ Unless required by applicable law or agreed to in writing, software
  ~ distributed under the License is distributed on an "AS IS" BASIS,
  ~ WITHOUT WARRANTIES OR CONDITIONS OF ANY KIND, either express or implied.
  ~ See the License for the specific language governing permissions and
  ~ limitations under the License.
  -->

<!DOCTYPE AssemblerConfig SYSTEM "/Rhythmyx/DTD/sys_AssemblerConfig.dtd">
<AssemblerConfig>
	<Globals>
		<System>file:sys_resources/stylesheets/assemblers/sys_Globals.xsl</System>
		<Rhythmyx>file:rx_resources/stylesheets/assemblers/rx_Globals.xsl</Rhythmyx>
	</Globals>
	<GlobalTemplates>
		<System>file:sys_resources/stylesheets/assemblers/sys_GlobalTemplates.xsl</System>
		<Rhythmyx>file:rx_resources/stylesheets/assemblers/rx_GlobalTemplates.xsl</Rhythmyx>
	</GlobalTemplates>
	<ContextTemplates>
		<System>file:sys_resources/stylesheets/assemblers/sys_ContextTemplates.xsl</System>
	</ContextTemplates>
	<SlotTemplates>
		<System>file:sys_resources/stylesheets/assemblers/sys_Slots.xsl</System>
		<Rhythmyx>file:rx_resources/stylesheets/assemblers/rx_Slots.xsl</Rhythmyx>
	</SlotTemplates>
	<InlineLinkTemplates>
		<System>file:sys_resources/stylesheets/assemblers/sys_InlineLinks.xsl</System>
		<Rhythmyx>file:rx_resources/stylesheets/assemblers/rx_InlineLinks.xsl</Rhythmyx>
	</InlineLinkTemplates>
</AssemblerConfig>
